<!ELEMENT alumnos (alumno+)>
<!ELEMENT alumno (nombre, apellido, edad, residencia, sexo, pais)>
<!ATTLIST alumno id ID #REQUIRED>
<!ELEMENT nombre (#PCDATA)>
<!ELEMENT apellido (#PCDATA)>
<!ELEMENT edad (#PCDATA)>
<!ELEMENT residencia (#PCDATA)>
<!ELEMENT sexo (#PCDATA)>
<!ELEMENT pais (#PCDATA)>